{
  "$schema": "https://json-schema.org/draft/2020-12/schema",
  "type": "object",
  "properties": {
    "preferred_title": {
      "type": "string",
      "minLength": 1
    },
    "variant_title": {
      "type": "string"
    },
    "parallel_title": {
      "type": "string"
    },
    "title_statement": {
      "type": "string"
    },
    "subtitle_statement": {
      "type": "string"
    },
    "incipit_statement": {
      "type": "string"
    },
    "responsibility_statement": {
      "type": "string"
    },
    "place_statement": {
      "type": "string"
    },
    "publication_statement": {
      "type": "string"
    },
    "year": {
      "type": "number"
    },
    "pseudonym": {
      "type": "boolean"
    },
    "language": {
      "type": "array",
      "items": {
        "type": "string",
        "enum": [
          "abk",
          "aar",
          "afr",
          "aka",
          "alb",
          "amh",
          "ara",
          "arg",
          "arm",
          "asm",
          "ava",
          "ave",
          "aym",
          "aze",
          "bam",
          "bak",
          "baq",
          "bel",
          "ben",
          "bis",
          "bos",
          "bre",
          "bul",
          "bur",
          "cat",
          "cha",
          "che",
          "nya",
          "chi",
          "chu",
          "chv",
          "cor",
          "cos",
          "cre",
          "hrv",
          "cze",
          "dan",
          "div",
          "dut",
          "dzo",
          "eng",
          "epo",
          "est",
          "ewe",
          "fao",
          "fij",
          "fin",
          "fre",
          "fry",
          "ful",
          "gla",
          "glg",
          "lug",
          "geo",
          "ger",
          "gre",
          "kal",
          "grn",
          "guj",
          "hat",
          "hau",
          "heb",
          "her",
          "hin",
          "hmo",
          "hun",
          "ice",
          "ido",
          "ibo",
          "ind",
          "ina",
          "ile",
          "iku",
          "ipk",
          "gle",
          "ita",
          "jpn",
          "jav",
          "kan",
          "kau",
          "kas",
          "kaz",
          "khm",
          "kik",
          "kin",
          "kir",
          "kom",
          "kon",
          "kor",
          "kua",
          "kur",
          "lao",
          "lat",
          "lav",
          "lim",
          "lin",
          "lit",
          "lub",
          "ltz",
          "mac",
          "mlg",
          "may",
          "mal",
          "mlt",
          "glv",
          "mao",
          "mar",
          "mah",
          "mon",
          "nau",
          "nav",
          "nde",
          "nbl",
          "ndo",
          "nep",
          "nor",
          "nob",
          "nno",
          "oci",
          "oji",
          "ori",
          "orm",
          "oss",
          "pli",
          "pus",
          "per",
          "pol",
          "por",
          "pan",
          "que",
          "rum",
          "roh",
          "run",
          "rus",
          "sme",
          "smo",
          "sag",
          "san",
          "srd",
          "srp",
          "sna",
          "snd",
          "sin",
          "slo",
          "slv",
          "som",
          "sot",
          "spa",
          "sun",
          "swa",
          "ssw",
          "swe",
          "tgl",
          "tah",
          "tgk",
          "tam",
          "tat",
          "tel",
          "tha",
          "tib",
          "tir",
          "ton",
          "tso",
          "tsn",
          "tur",
          "tuk",
          "twi",
          "uig",
          "ukr",
          "urd",
          "uzb",
          "ven",
          "vie",
          "vol",
          "wln",
          "wel",
          "wol",
          "xho",
          "iii",
          "yid",
          "yor",
          "zha",
          "zul",
          ""
        ]
      },
      "maxItems": 183,
      "uniqueItems": true
    },
    "content_type": {
      "type": "array",
      "items": {
        "type": "string",
        "enum": [
          "kartografisches Daten-Set",
          "kartografisches Bild",
          "kartografisches Bewegtbild",
          "kartografisches taktiles Bild",
          "kartografische taktile dreidimensionale Form",
          "kartografische dreidimensionale Form",
          "Computerdaten",
          "Computerprogramm",
          "Bewegungsnotation",
          "Noten",
          "aufgeführte Musik",
          "Geräusche",
          "gesprochenes Wort",
          "unbewegtes Bild",
          "taktiles Bild",
          "taktile Noten",
          "taktile Bewegungsnotation",
          "taktiler Text",
          "taktile dreidimensionale Form",
          "Text",
          "dreidimensionale Form",
          "dreidimensionales Bewegtbild",
          "zweidimensionales Bewegtbild",
          "aufgeführte Bewegung",
          ""
        ]
      },
      "maxItems": 24,
      "uniqueItems": true
    },
    "extent": {
      "type": "string"
    },
    "dimensions": {
      "type": "string"
    },
    "musenalm_type": {
      "type": "array",
      "items": {
        "type": "string",
        "enum": [
          "Corrigenda",
          "Diagramm",
          "Gedicht/Lied",
          "Graphik",
          "Graphik-Verzeichnis",
          "graph. Anleitung",
          "graph. Strickanleitung",
          "graph. Tanzanleitung",
          "Inhaltsverzeichnis",
          "Kalendarium",
          "Karte",
          "Musikbeigabe",
          "Musikbeigaben-Verzeichnis",
          "Motto",
          "Prosa",
          "Rätsel",
          "Sammlung",
          "Spiegel",
          "szen. Darstellung",
          "Tabelle",
          "Tafel",
          "Titel",
          "Text",
          "Trinkspruch",
          "Umschlag",
          "Widmung",
          ""
        ]
      },
      "maxItems": 26,
      "uniqueItems": true
    },
    "musenalm_pagination": {
      "type": "array",
      "items": {
        "type": "string",
        "enum": [
          "5. Römische Seitenzählung",
          "7. Römische Seitenzählung",
          "1. Arabische Seitenzählung",
          "4. Römische Seitenzählung",
          "Arabische Seitenzählung",
          "Alphabetische Seitenzählung",
          "2. Arabische Seitenzählung",
          "5. Arabische Seitenzählung",
          "6. Arabische Seitenzählung",
          "8. Römische Seitenzählung",
          "",
          "Römische Seitenzählung",
          "Sonstige Seitenzählung",
          "4. Arabische Seitenzählung",
          "7. Arabische Seitenzählung",
          "1. Römische Seitenzählung",
          "2. Römische Seitenzählung",
          "6. Römische Seitenzählung",
          "3. Arabische Seitenzählung",
          "8. Arabische Seitenzählung",
          "3. Römische Seitenzählung"
        ]
      },
      "maxItems": 21,
      "uniqueItems": true
    },
    "scans": {
      "type": "array",
      "items": {
        "type": "string"
      },
      "maxItems": 1000,
      "uniqueItems": true,
      "description": "Original scan filenames. Binary files were not included in the export."
    },
    "numbering": {
      "type": "number"
    },
    "musenalm_id": {
      "type": "number"
    },
    "created": {
      "type": "string",
      "readOnly": true
    },
    "updated": {
      "type": "string",
      "readOnly": true
    },
    "edit_state": {
      "type": "string",
      "enum": [
        "Unknown",
        "ToDo",
        "Seen",
        "Partially Edited",
        "Waiting",
        "Review",
        "Edited",
        ""
      ]
    },
    "annotation": {
      "type": "string",
      "x-content": "markdown"
    },
    "edit_comment": {
      "type": "string",
      "x-content": "markdown"
    },
    "editor": {
      "type": "string",
      "description": "Source users ID; that collection was not included in the export.",
      "readOnly": true
    },
    "agents": {
      "type": "array",
      "default": [],
      "items": {
        "type": "object",
        "properties": {
          "source_id": {
            "type": "string",
            "minLength": 15,
            "maxLength": 15,
            "pattern": "^[a-z0-9]+$",
            "readOnly": true
          },
          "agent": {
            "type": "string",
            "x-relation": {
              "collection": "agents"
            }
          },
          "type": {
            "type": "string",
            "enum": [
              "Autor:in",
              "Herausgeber:in",
              "Verlag",
              "Druck",
              "Vertrieb",
              "Zeichner:in",
              "Komponist:in",
              "Künstler:in",
              "Übersetzer:in",
              "Redakteur:in",
              "Kartograf:in",
              "Kupferstecher:in",
              "Dargestellt"
            ]
          },
          "conjecture": {
            "type": "boolean"
          },
          "uncertain": {
            "type": "boolean"
          },
          "created": {
            "type": "string",
            "readOnly": true
          },
          "updated": {
            "type": "string",
            "readOnly": true
          },
          "annotation": {
            "type": "string",
            "x-content": "markdown"
          },
          "edit_comment": {
            "type": "string",
            "x-content": "markdown"
          }
        },
        "required": [
          "agent"
        ],
        "additionalProperties": false
      }
    }
  },
  "required": [
    "preferred_title",
    "musenalm_id"
  ],
  "additionalProperties": false
}
