{
  "annotation": "paginiert 1. /) Détail aus »Le mariage à la mode par Hogarth« INr 73360, Obj 54 s. Textbezug INr 73361, Obj 55",
  "content_type": [],
  "created": "2026-06-11 10:18:20.893Z",
  "dimensions": "",
  "edit_comment": "",
  "edit_state": "Edited",
  "extent": "116",
  "incipit_statement": "",
  "language": [],
  "musenalm_id": 73362,
  "musenalm_pagination": [
    "Arabische Seitenzählung"
  ],
  "musenalm_type": [
    "Graphik"
  ],
  "numbering": 56,
  "parallel_title": "",
  "place_statement": "",
  "preferred_title": "A",
  "pseudonym": false,
  "publication_statement": "",
  "responsibility_statement": "Nach W. Hogarth von Riepenhausen gest.",
  "scans": [
    "alm_159_73362_nrwg34vh60.jpg"
  ],
  "subtitle_statement": "",
  "title_statement": "A",
  "updated": "2000-11-30 00:00:00.000Z",
  "variant_title": "",
  "year": 1786,
  "editor": "",
  "agents": [
    {
      "annotation": "",
      "conjecture": false,
      "created": "2026-06-11 10:19:00.769Z",
      "edit_comment": "",
      "type": "Autor:in",
      "uncertain": false,
      "updated": "2026-06-11 10:19:00.769Z",
      "agent": "yylanvnf5ct4jbi",
      "source_id": "9cz3hsbf2epk5ky"
    },
    {
      "annotation": "",
      "conjecture": false,
      "created": "2026-06-11 10:19:00.769Z",
      "edit_comment": "",
      "type": "Autor:in",
      "uncertain": false,
      "updated": "2026-06-11 10:19:00.769Z",
      "agent": "s50e2koeoxpuipg",
      "source_id": "vjm6gp23crplgl8"
    }
  ]
}
