{
  "annotation": "",
  "content_type": [],
  "created": "2026-06-11 10:17:42.760Z",
  "dimensions": "",
  "edit_comment": "",
  "edit_state": "Edited",
  "extent": "224",
  "incipit_statement": "Gesang macht munter! Auf, ihr Freunde / Laßt uns singen",
  "language": [],
  "musenalm_id": 4184,
  "musenalm_pagination": [
    "Arabische Seitenzählung"
  ],
  "musenalm_type": [
    "Gedicht/Lied"
  ],
  "numbering": 129,
  "parallel_title": "",
  "place_statement": "",
  "preferred_title": "Aufruf zu Gesang",
  "pseudonym": false,
  "publication_statement": "",
  "responsibility_statement": "Gleim",
  "scans": [],
  "subtitle_statement": "",
  "title_statement": "Aufruf zu Gesang",
  "updated": "2000-09-26 00:00:00.000Z",
  "variant_title": "",
  "year": 1796,
  "editor": "",
  "agents": [
    {
      "annotation": "",
      "conjecture": false,
      "created": "2026-06-11 10:18:56.987Z",
      "edit_comment": "",
      "type": "Autor:in",
      "uncertain": false,
      "updated": "2026-06-11 10:18:56.987Z",
      "agent": "33cr5ecwlcsbopd",
      "source_id": "qfg9zgp6kkx7y4k"
    }
  ]
}
