{
  "annotation": "Anhang (Sammlung INr 7768, Obj 52)",
  "content_type": [],
  "created": "2026-06-11 10:17:43.620Z",
  "dimensions": "",
  "edit_comment": "",
  "edit_state": "Edited",
  "extent": "19",
  "incipit_statement": "",
  "language": [],
  "musenalm_id": 7779,
  "musenalm_pagination": [
    "2. Arabische Seitenzählung"
  ],
  "musenalm_type": [
    "Prosa"
  ],
  "numbering": 63,
  "parallel_title": "",
  "place_statement": "",
  "preferred_title": "Besondere Zahlbenennungen",
  "pseudonym": false,
  "publication_statement": "",
  "responsibility_statement": "unbezeichnet",
  "scans": [],
  "subtitle_statement": "",
  "title_statement": "Besondere Zahlbenennungen",
  "updated": "2000-12-07 00:00:00.000Z",
  "variant_title": "",
  "year": 1809,
  "editor": "",
  "agents": []
}
