{
  "annotation": "Drei Stehgreifsepigrammen nach Aufgaben im Pfänderspiele (Sammlung INr 4173, Obj 118)",
  "content_type": [],
  "created": "2026-06-11 10:17:42.947Z",
  "dimensions": "",
  "edit_comment": "",
  "edit_state": "Edited",
  "extent": "208",
  "incipit_statement": "Drei Elementen war er Hasser: / In Kopf und Herz und Deckelglas dem / Wasser;",
  "language": [],
  "musenalm_id": 4175,
  "musenalm_pagination": [
    "Arabische Seitenzählung"
  ],
  "musenalm_type": [
    "Gedicht/Lied"
  ],
  "numbering": 120,
  "parallel_title": "",
  "place_statement": "",
  "preferred_title": "2. / Den Alt-Teutschen nach den vier Elemen- / ten zu schildern",
  "pseudonym": false,
  "publication_statement": "",
  "responsibility_statement": "Fridrich",
  "scans": [],
  "subtitle_statement": "",
  "title_statement": "2. / Den Alt-Teutschen nach den vier Elemen- / ten zu schildern",
  "updated": "2000-09-26 00:00:00.000Z",
  "variant_title": "",
  "year": 1796,
  "editor": "",
  "agents": [
    {
      "annotation": "",
      "conjecture": false,
      "created": "2026-06-11 10:18:57.011Z",
      "edit_comment": "",
      "type": "Autor:in",
      "uncertain": false,
      "updated": "2026-06-11 10:18:57.011Z",
      "agent": "t3zz4r3fvdi80ts",
      "source_id": "cl6konfskhicydc"
    }
  ]
}
