{
  "annotation": "separates Kalendarium",
  "content_type": [],
  "created": "2026-06-11 10:18:06.953Z",
  "dimensions": "",
  "edit_comment": "",
  "edit_state": "Edited",
  "extent": "",
  "incipit_statement": "",
  "language": [],
  "musenalm_id": 54292,
  "musenalm_pagination": [],
  "musenalm_type": [
    "Kalendarium"
  ],
  "numbering": 114,
  "parallel_title": "",
  "place_statement": "",
  "preferred_title": "Almanach /auf / das / Jahr Christi / 1827",
  "pseudonym": false,
  "publication_statement": "",
  "responsibility_statement": "unbezeichnet",
  "scans": [],
  "subtitle_statement": "",
  "title_statement": "Almanach /auf / das / Jahr Christi / 1827",
  "updated": "2008-01-18 00:00:00.000Z",
  "variant_title": "",
  "year": 1827,
  "editor": "",
  "agents": []
}
