{
  "annotation": "Illustration zu »Drittes Jahrhundert der Kirchengeschichte« INr 127528, Obj 3 /) nummeriert 42",
  "content_type": [],
  "created": "2026-06-11 10:18:50.283Z",
  "dimensions": "",
  "edit_comment": "",
  "edit_state": "Edited",
  "extent": "88",
  "incipit_statement": "",
  "language": [],
  "musenalm_id": 127534,
  "musenalm_pagination": [
    "Arabische Seitenzählung"
  ],
  "musenalm_type": [
    "Graphik"
  ],
  "numbering": 9,
  "parallel_title": "",
  "place_statement": "",
  "preferred_title": "Martyrium S. Laurentii",
  "pseudonym": false,
  "publication_statement": "",
  "responsibility_statement": "Monsorno inv. Weinrauch sc.",
  "scans": [
    "alm_4771_127534_h7i3p6oj9z.jpg"
  ],
  "subtitle_statement": "",
  "title_statement": "Martyrium S. Laurentii",
  "updated": "2021-01-13 00:00:00.000Z",
  "variant_title": "",
  "year": 1795,
  "editor": "",
  "agents": [
    {
      "annotation": "",
      "conjecture": false,
      "created": "2026-06-11 10:19:02.944Z",
      "edit_comment": "",
      "type": "Autor:in",
      "uncertain": false,
      "updated": "2026-06-11 10:19:02.944Z",
      "agent": "h37i7hdd1a10o2d",
      "source_id": "8lzrt3p2a1zo5ke"
    },
    {
      "annotation": "",
      "conjecture": false,
      "created": "2026-06-11 10:19:02.944Z",
      "edit_comment": "",
      "type": "Autor:in",
      "uncertain": false,
      "updated": "2026-06-11 10:19:02.944Z",
      "agent": "nhcnwrqiq042uja",
      "source_id": "fxutfzpkp734fk4"
    }
  ]
}
