{
  "annotation": "",
  "content_type": [],
  "created": "2026-06-11 10:18:31.103Z",
  "dimensions": "",
  "edit_comment": "",
  "edit_state": "Edited",
  "extent": "107",
  "incipit_statement": "In kalter Asche schlief der Götterfunken, / Den gütig Gott gepflanzt in Menschen- / brust;",
  "language": [],
  "musenalm_id": 93837,
  "musenalm_pagination": [
    "Arabische Seitenzählung"
  ],
  "musenalm_type": [
    "Gedicht/Lied"
  ],
  "numbering": 31,
  "parallel_title": "",
  "place_statement": "",
  "preferred_title": "Der Dichter",
  "pseudonym": false,
  "publication_statement": "",
  "responsibility_statement": "unbezeichnet",
  "scans": [],
  "subtitle_statement": "",
  "title_statement": "Der Dichter",
  "updated": "2009-01-22 00:00:00.000Z",
  "variant_title": "",
  "year": 1825,
  "editor": "",
  "agents": []
}
