{
  "annotation": "",
  "content_type": [],
  "created": "2026-06-11 10:17:50.941Z",
  "dimensions": "",
  "edit_comment": "",
  "edit_state": "Edited",
  "extent": "207",
  "incipit_statement": "Echo, Echo! in der Buchen Grunde, / Pythia der wilden Bergnatur!",
  "language": [],
  "musenalm_id": 19410,
  "musenalm_pagination": [
    "Arabische Seitenzählung"
  ],
  "musenalm_type": [
    "Gedicht/Lied"
  ],
  "numbering": 43,
  "parallel_title": "",
  "place_statement": "",
  "preferred_title": "Der Widerhall",
  "pseudonym": false,
  "publication_statement": "",
  "responsibility_statement": "F. Krug v. Nidda",
  "scans": [],
  "subtitle_statement": "",
  "title_statement": "Der Widerhall",
  "updated": "2001-11-26 00:00:00.000Z",
  "variant_title": "",
  "year": 1815,
  "editor": "",
  "agents": [
    {
      "annotation": "",
      "conjecture": false,
      "created": "2026-06-11 10:18:57.931Z",
      "edit_comment": "",
      "type": "Autor:in",
      "uncertain": false,
      "updated": "2026-06-11 10:18:57.931Z",
      "agent": "ynj6s229zp88pv2",
      "source_id": "p53kzhkjs4ghs0y"
    }
  ]
}
