{
  "annotation": "Vermischte Gedichte (Sammlung INr 36820, Obj 75)",
  "content_type": [],
  "created": "2026-06-11 10:17:58.501Z",
  "dimensions": "",
  "edit_comment": "",
  "edit_state": "Edited",
  "extent": "296",
  "incipit_statement": "Braver Klepper, ohne Falsch und Tücken, / Immer munter, immer nett und glatt,",
  "language": [],
  "musenalm_id": 36830,
  "musenalm_pagination": [
    "Arabische Seitenzählung"
  ],
  "musenalm_type": [
    "Gedicht/Lied"
  ],
  "numbering": 87,
  "parallel_title": "",
  "place_statement": "",
  "preferred_title": "An mein Reitpferd",
  "pseudonym": false,
  "publication_statement": "",
  "responsibility_statement": "F. W. A. Schmidt",
  "scans": [],
  "subtitle_statement": "",
  "title_statement": "An mein Reitpferd",
  "updated": "2004-03-18 00:00:00.000Z",
  "variant_title": "",
  "year": 1802,
  "editor": "",
  "agents": [
    {
      "annotation": "",
      "conjecture": false,
      "created": "2026-06-11 10:18:58.905Z",
      "edit_comment": "",
      "type": "Autor:in",
      "uncertain": false,
      "updated": "2026-06-11 10:18:58.905Z",
      "agent": "crhcmocsovty64w",
      "source_id": "lspsyxnny4du9s3"
    }
  ]
}
