{
  "annotation": "Illustration zu »An Fräulein von ** in D**« von J. G. Jacobi INr 43, Obj 22",
  "content_type": [],
  "created": "2026-06-11 10:17:42.866Z",
  "dimensions": "",
  "edit_comment": "",
  "edit_state": "Edited",
  "extent": "104",
  "incipit_statement": "",
  "language": [],
  "musenalm_id": 97,
  "musenalm_pagination": [
    "Arabische Seitenzählung"
  ],
  "musenalm_type": [
    "Graphik"
  ],
  "numbering": 24,
  "parallel_title": "",
  "place_statement": "",
  "preferred_title": "Hymen",
  "pseudonym": false,
  "publication_statement": "",
  "responsibility_statement": "gravé par Texier",
  "scans": [
    "alm_25_97_10g9zbn93p.jpg"
  ],
  "subtitle_statement": "",
  "title_statement": "Hymen",
  "updated": "2001-06-12 00:00:00.000Z",
  "variant_title": "",
  "year": 1803,
  "editor": "",
  "agents": []
}
