{
  "annotation": "Grotesken und Naivitäten der Morgenländer, gesammelt aus dem Talmud und einigen alten christlichen Geschichtsschreibern (Sammlung INr 73236, Obj 32)",
  "content_type": [],
  "created": "2026-06-11 10:18:17.994Z",
  "dimensions": "",
  "edit_comment": "",
  "edit_state": "Edited",
  "extent": "221",
  "incipit_statement": "Es hat der Rabi, des Channa Enkel, gesagt: Wir fuhren einmal in einem Schiff, und sahen einen Vogel, welcher bis an sein Schienbein in dem Wasser stund und sein Kropf reichte bis an das Firnament des Himmels.",
  "language": [],
  "musenalm_id": 73250,
  "musenalm_pagination": [
    "Arabische Seitenzählung"
  ],
  "musenalm_type": [
    "Prosa"
  ],
  "numbering": 46,
  "parallel_title": "",
  "place_statement": "",
  "preferred_title": "Von dem grossen Wundervogel, wel- / cher bey den Rainen Sir, auch Bar / juchne heisst. / (Aus dem Bava bathra Fol. col. 2.)",
  "pseudonym": false,
  "publication_statement": "",
  "responsibility_statement": "unbezeichnet",
  "scans": [],
  "subtitle_statement": "",
  "title_statement": "Von dem grossen Wundervogel, wel- / cher bey den Rainen Sir, auch Bar / juchne heisst. / (Aus dem Bava bathra Fol. col. 2.)",
  "updated": "2010-01-20 00:00:00.000Z",
  "variant_title": "",
  "year": 1807,
  "editor": "",
  "agents": []
}
