{
  "annotation": "",
  "content_type": [],
  "created": "2026-06-11 10:18:52.567Z",
  "dimensions": "",
  "edit_comment": "",
  "edit_state": "Edited",
  "extent": "",
  "incipit_statement": "",
  "language": [],
  "musenalm_id": 130060,
  "musenalm_pagination": [],
  "musenalm_type": [
    "Titel"
  ],
  "numbering": 5,
  "parallel_title": "",
  "place_statement": "",
  "preferred_title": "THE / ENGLISH FIRESIDE / UPON THE / BANKS OF THE RHINE",
  "pseudonym": false,
  "publication_statement": "",
  "responsibility_statement": "unbezeichnet",
  "scans": [],
  "subtitle_statement": "",
  "title_statement": "THE / ENGLISH FIRESIDE / UPON THE / BANKS OF THE RHINE",
  "updated": "2022-05-09 00:00:00.000Z",
  "variant_title": "",
  "year": 0,
  "editor": "",
  "agents": []
}
