{
  "annotation": "I. Räthsel (Sammlung INr 78831, Obj 19)",
  "content_type": [],
  "created": "2026-06-11 10:18:22.838Z",
  "dimensions": "",
  "edit_comment": "",
  "edit_state": "Edited",
  "extent": "37",
  "incipit_statement": "Man kocht's nicht, man kaut's nicht, man / schlingt's nicht, und schmeckt doch vielen gut.",
  "language": [],
  "musenalm_id": 78834,
  "musenalm_pagination": [
    "Arabische Seitenzählung"
  ],
  "musenalm_type": [
    "Rätsel"
  ],
  "numbering": 22,
  "parallel_title": "",
  "place_statement": "",
  "preferred_title": "3.",
  "pseudonym": false,
  "publication_statement": "",
  "responsibility_statement": "unbezeichnet",
  "scans": [],
  "subtitle_statement": "",
  "title_statement": "3.",
  "updated": "2010-02-18 00:00:00.000Z",
  "variant_title": "",
  "year": 1800,
  "editor": "",
  "agents": []
}
