{
  "annotation": "Wehmut und Liebe (Sammlung INr 49043, Obj 71)",
  "content_type": [],
  "created": "2026-06-11 10:18:03.151Z",
  "dimensions": "",
  "edit_comment": "",
  "edit_state": "Edited",
  "extent": "152",
  "incipit_statement": "Laß Andre Vieles seyn, und mehr als du auf Erden; / Hier trachte, ganz du selbst, ein Engel dort zu werden.",
  "language": [],
  "musenalm_id": 49057,
  "musenalm_pagination": [
    "Arabische Seitenzählung"
  ],
  "musenalm_type": [
    "Gedicht/Lied"
  ],
  "numbering": 87,
  "parallel_title": "",
  "place_statement": "",
  "preferred_title": "Sinnspruch",
  "pseudonym": false,
  "publication_statement": "",
  "responsibility_statement": "Friedrich, Baron de la Motte Fouqué",
  "scans": [],
  "subtitle_statement": "",
  "title_statement": "Sinnspruch",
  "updated": "2007-04-17 00:00:00.000Z",
  "variant_title": "",
  "year": 1812,
  "editor": "",
  "agents": [
    {
      "annotation": "",
      "conjecture": false,
      "created": "2026-06-11 10:18:59.482Z",
      "edit_comment": "",
      "type": "Autor:in",
      "uncertain": false,
      "updated": "2026-06-11 10:18:59.482Z",
      "agent": "vwa4f73bcjeod59",
      "source_id": "s7ofj7qo7a0c583"
    }
  ]
}
