{
  "annotation": "Oesterreichische Volkssagen (Sammlung INr 129951, Obj 94)",
  "content_type": [],
  "created": "2026-06-11 10:18:52.025Z",
  "dimensions": "",
  "edit_comment": "",
  "edit_state": "Edited",
  "extent": "220",
  "incipit_statement": "Als am Landungsplatze zu Fabiana der Verwundete anlangte, ward er mühsam über Schutt und Steine, nach dem, am meisten verheerten Theile der einst so blühenden Stadt getragen,",
  "language": [],
  "musenalm_id": 129955,
  "musenalm_pagination": [
    "Arabische Seitenzählung"
  ],
  "musenalm_type": [
    "Prosa"
  ],
  "numbering": 98,
  "parallel_title": "",
  "place_statement": "",
  "preferred_title": "4. / Die St. Rupprechtskirche in Wien",
  "pseudonym": true,
  "publication_statement": "",
  "responsibility_statement": "Emil",
  "scans": [],
  "subtitle_statement": "",
  "title_statement": "4. / Die St. Rupprechtskirche in Wien",
  "updated": "2022-03-23 00:00:00.000Z",
  "variant_title": "",
  "year": 1835,
  "editor": "",
  "agents": [
    {
      "annotation": "",
      "conjecture": false,
      "created": "2026-06-11 10:19:03.027Z",
      "edit_comment": "",
      "type": "Autor:in",
      "uncertain": false,
      "updated": "2026-06-11 10:19:03.027Z",
      "agent": "wzmgymh9fjau9gk",
      "source_id": "nsaugmkea7c8z1q"
    }
  ]
}
