{
  "annotation": "",
  "content_type": [],
  "created": "2026-06-15 10:59:38.655Z",
  "dimensions": "",
  "edit_comment": "",
  "edit_state": "Edited",
  "extent": "9",
  "incipit_statement": "",
  "language": [],
  "musenalm_id": 140003,
  "musenalm_pagination": [
    "Arabische Seitenzählung"
  ],
  "musenalm_type": [
    "Text"
  ],
  "numbering": 4,
  "parallel_title": "",
  "place_statement": "",
  "preferred_title": "A MESSIEURS / LES / JOURNALISTES.",
  "pseudonym": false,
  "publication_statement": "",
  "responsibility_statement": "",
  "scans": [],
  "subtitle_statement": "",
  "title_statement": "A MESSIEURS / LES / JOURNALISTES.",
  "updated": "2026-06-15 11:16:19.007Z",
  "variant_title": "",
  "year": 1786,
  "editor": "hbwf3kmsfyyeo1u",
  "agents": []
}
