{
  "annotation": "Graphik (Portrait) im Kalendarium Februar",
  "content_type": [],
  "created": "2026-06-11 10:18:31.834Z",
  "dimensions": "",
  "edit_comment": "",
  "edit_state": "Edited",
  "extent": "",
  "incipit_statement": "",
  "language": [],
  "musenalm_id": 96268,
  "musenalm_pagination": [],
  "musenalm_type": [
    "Graphik"
  ],
  "numbering": 6,
  "parallel_title": "",
  "place_statement": "",
  "preferred_title": "Johannes Austriacus / Princeps Francoevillae",
  "pseudonym": false,
  "publication_statement": "",
  "responsibility_statement": "unbezeichnet",
  "scans": [
    "alm_2185_96268_kk8vs5ab77.jpg"
  ],
  "subtitle_statement": "",
  "title_statement": "Johannes Austriacus / Princeps Francoevillae",
  "updated": "2010-01-27 00:00:00.000Z",
  "variant_title": "",
  "year": 1802,
  "editor": "",
  "agents": []
}
