{
  "annotation": "paginiert 1 /) Illustration zu »Beschreibung des Gartens in Hohenheim. Zweite Fortsetzung. / Der Zirkelbau« von G. H. Rapp INr 74217, Obj 11 /) # Zuschreibung: Fischer S. 244",
  "content_type": [],
  "created": "2026-06-11 10:18:17.536Z",
  "dimensions": "",
  "edit_comment": "",
  "edit_state": "Edited",
  "extent": "66",
  "incipit_statement": "",
  "language": [],
  "musenalm_id": 74216,
  "musenalm_pagination": [
    "Arabische Seitenzählung"
  ],
  "musenalm_type": [
    "Graphik"
  ],
  "numbering": 10,
  "parallel_title": "",
  "place_statement": "",
  "preferred_title": "Der Zirkelbau",
  "pseudonym": true,
  "publication_statement": "",
  "responsibility_statement": "unbezeichnet",
  "scans": [
    "alm_3110_74216_0gm5c0rumc.jpg"
  ],
  "subtitle_statement": "",
  "title_statement": "Der Zirkelbau",
  "updated": "2010-02-26 00:00:00.000Z",
  "variant_title": "",
  "year": 1797,
  "editor": "",
  "agents": [
    {
      "annotation": "",
      "conjecture": false,
      "created": "2026-06-11 10:19:00.525Z",
      "edit_comment": "",
      "type": "Autor:in",
      "uncertain": false,
      "updated": "2026-06-11 10:19:00.525Z",
      "agent": "yos6i167q0dzqb7",
      "source_id": "moz9447guoeyeg8"
    }
  ]
}
