{
  "annotation": "",
  "content_type": [],
  "created": "2026-06-11 10:18:45.936Z",
  "dimensions": "",
  "edit_comment": "",
  "edit_state": "Edited",
  "extent": "141",
  "incipit_statement": "Am dämmernden Horizonte, / Im scheidenden Abendlicht / Glühet die Stadt,",
  "language": [],
  "musenalm_id": 117688,
  "musenalm_pagination": [
    "Arabische Seitenzählung"
  ],
  "musenalm_type": [
    "Gedicht/Lied"
  ],
  "numbering": 39,
  "parallel_title": "",
  "place_statement": "",
  "preferred_title": "Abendläuten",
  "pseudonym": false,
  "publication_statement": "",
  "responsibility_statement": "Ant. Langer",
  "scans": [],
  "subtitle_statement": "",
  "title_statement": "Abendläuten",
  "updated": "2017-03-17 00:00:00.000Z",
  "variant_title": "",
  "year": 1847,
  "editor": "",
  "agents": [
    {
      "annotation": "",
      "conjecture": false,
      "created": "2026-06-11 10:19:02.685Z",
      "edit_comment": "",
      "type": "Autor:in",
      "uncertain": false,
      "updated": "2026-06-11 10:19:02.685Z",
      "agent": "5vrpezk8s9sgvqz",
      "source_id": "idt0qoa6ryaotmv"
    }
  ]
}
