{
  "annotation": "",
  "content_type": [],
  "created": "2026-06-11 10:18:01.315Z",
  "dimensions": "",
  "edit_comment": "",
  "edit_state": "Edited",
  "extent": "",
  "incipit_statement": "",
  "language": [],
  "musenalm_id": 41466,
  "musenalm_pagination": [],
  "musenalm_type": [
    "Graphik"
  ],
  "numbering": 19,
  "parallel_title": "",
  "place_statement": "",
  "preferred_title": "Basalt-aehnliches Gebirge bei Monterey oberhalb Californiens",
  "pseudonym": false,
  "publication_statement": "",
  "responsibility_statement": "unbezeichnet",
  "scans": [
    "alm_541_41466_b5a9kiwsi2.jpg"
  ],
  "subtitle_statement": "",
  "title_statement": "Basalt-aehnliches Gebirge bei Monterey oberhalb Californiens",
  "updated": "2005-11-28 00:00:00.000Z",
  "variant_title": "",
  "year": 1805,
  "editor": "",
  "agents": []
}
