{
  "annotation": "Lenz-Kommando. Liederscherz (Sammlung INr 103817, Obj 53)",
  "content_type": [],
  "created": "2026-06-11 10:18:35.486Z",
  "dimensions": "",
  "edit_comment": "",
  "edit_state": "Edited",
  "extent": "327",
  "incipit_statement": "Halt, sag' ich, halt! Nicht weiter! / Nun steht die Fronte da,",
  "language": [],
  "musenalm_id": 103819,
  "musenalm_pagination": [
    "Arabische Seitenzählung"
  ],
  "musenalm_type": [
    "Gedicht/Lied"
  ],
  "numbering": 55,
  "parallel_title": "",
  "place_statement": "",
  "preferred_title": "2. / Halt",
  "pseudonym": false,
  "publication_statement": "",
  "responsibility_statement": "Joh. Gabriel Seidl",
  "scans": [],
  "subtitle_statement": "",
  "title_statement": "2. / Halt",
  "updated": "2010-01-21 00:00:00.000Z",
  "variant_title": "",
  "year": 1838,
  "editor": "",
  "agents": [
    {
      "annotation": "",
      "conjecture": false,
      "created": "2026-06-11 10:19:02.043Z",
      "edit_comment": "",
      "type": "Autor:in",
      "uncertain": false,
      "updated": "2026-06-11 10:19:02.043Z",
      "agent": "uto0tazb8xl0ih3",
      "source_id": "gx15rrsaiu94rgl"
    }
  ]
}
